{
  "$schema": "https://json-schema.org/draft/2020-12/schema",
  "$id": "https://pavalife.com/schema/device_data_contract_v2_1.schema.json",
  "title": "PavaLife Device Data Contract v2.1",
  "type": "object",
  "additionalProperties": false,
  "required": ["schema_version", "message_id", "message_type", "event_time",
               "sequence_no", "facility", "gateway", "source", "payload"],
  "properties": {
    "schema_version": { "const": "2.1" },
    "message_id": { "type": "string", "format": "uuid" },
    "message_type": {
      "enum": ["observation.vitals", "observation.lab", "observation.waveform",
               "event.alarm", "device.status"]
    },
    "event_time": { "type": "string", "format": "date-time" },
    "sequence_no": { "type": "integer", "minimum": 0 },
    "facility": { "$ref": "#/$defs/facility" },
    "gateway": { "$ref": "#/$defs/gateway" },
    "source": { "$ref": "#/$defs/source" },
    "patient_context": { "$ref": "#/$defs/patientContext" },
    "payload": { "type": "object" }
  },
  "allOf": [
    { "if": { "properties": { "message_type": { "const": "observation.vitals" } }, "required": ["message_type"] },
      "then": { "required": ["patient_context"], "properties": { "payload": { "$ref": "#/$defs/vitalsPayload" } } } },
    { "if": { "properties": { "message_type": { "const": "observation.waveform" } }, "required": ["message_type"] },
      "then": { "required": ["patient_context"], "properties": { "payload": { "$ref": "#/$defs/vitalsPayload" } } } },
    { "if": { "properties": { "message_type": { "const": "observation.lab" } }, "required": ["message_type"] },
      "then": { "required": ["patient_context"], "properties": { "payload": { "$ref": "#/$defs/labPayload" } } } },
    { "if": { "properties": { "message_type": { "const": "device.status" } }, "required": ["message_type"] },
      "then": { "properties": { "payload": { "$ref": "#/$defs/statusPayload" } } } }
  ],
  "$defs": {
    "facility": {
      "type": "object", "additionalProperties": false,
      "required": ["facility_id"],
      "properties": {
        "facility_id": { "type": "string" },
        "department_id": { "type": "string" },
        "room_id": { "type": "string" },
        "bed_id": { "type": "string" }
      }
    },
    "gateway": {
      "type": "object", "additionalProperties": false,
      "required": ["gateway_id", "received_at", "published_at", "clock_source"],
      "properties": {
        "gateway_id": { "type": "string" },
        "software_version": { "type": "string" },
        "received_at": { "type": "string", "format": "date-time" },
        "published_at": { "type": "string", "format": "date-time" },
        "clock_source": { "enum": ["ntp", "ptp", "rtc", "unsynced", "unknown"] }
      }
    },
    "source": {
      "type": "object", "additionalProperties": false,
      "required": ["source_id", "source_type"],
      "properties": {
        "source_id": { "type": "string" },
        "source_type": { "enum": ["robot_doctor", "lab_analyzer", "lis", "patient_monitor", "other"] },
        "connection": { "enum": ["ble", "ethernet", "wifi", "serial", "https", "vendor_api", "other"] }
      }
    },
    "patientContext": {
      "type": "object", "additionalProperties": false,
      "required": ["patient_id", "patient_id_issuer", "encounter_id", "encounter_id_issuer", "binding"],
      "properties": {
        "patient_id": { "type": ["string", "null"] },
        "patient_id_issuer": { "type": ["string", "null"] },
        "encounter_id": { "type": ["string", "null"] },
        "encounter_id_issuer": { "type": ["string", "null"] },
        "binding": {
          "type": "object", "additionalProperties": false,
          "required": ["method", "status", "bound_at"],
          "properties": {
            "binding_id": { "type": "string" },
            "method": { "enum": ["qr_scan", "his_api", "manual", "unknown"] },
            "status": { "enum": ["pending_verification", "verified", "rejected", "unknown"] },
            "bound_at": { "type": "string", "format": "date-time" }
          }
        }
      }
    },
    "code": {
      "type": "object", "additionalProperties": false,
      "required": ["system", "code", "display"],
      "properties": {
        "system": { "type": "string" },
        "code": { "type": "string" },
        "display": { "type": "string" }
      }
    },
    "unit": {
      "type": "object", "additionalProperties": false,
      "required": ["system", "code", "display"],
      "properties": {
        "system": { "type": "string" },
        "code": { "type": "string" },
        "display": { "type": "string" }
      }
    },
    "quality": {
      "type": "object", "additionalProperties": false,
      "required": ["status"],
      "properties": {
        "status": { "enum": ["good", "suspect", "invalid", "unavailable"] },
        "reason": { "type": "string" }
      }
    },
    "component": {
      "type": "object", "additionalProperties": false,
      "required": ["local_code", "code"],
      "properties": {
        "local_code": { "type": "string" },
        "code": { "$ref": "#/$defs/code" },
        "value": { "type": "number" },
        "unit": { "$ref": "#/$defs/unit" },
        "data_absent_reason": { "type": "string" }
      },
      "oneOf": [
        { "required": ["value", "unit"] },
        { "required": ["data_absent_reason"] }
      ]
    },
    "measurement": {
      "type": "object", "additionalProperties": false,
      "required": ["observation_id", "local_code", "code", "measured_at", "status", "quality"],
      "properties": {
        "observation_id": { "type": "string" },
        "local_code": { "type": "string" },
        "code": { "$ref": "#/$defs/code" },
        "measured_at": { "type": "string", "format": "date-time" },
        "status": { "enum": ["registered", "preliminary", "final", "amended", "corrected",
                             "cancelled", "entered-in-error", "unknown"] },
        "quality": { "$ref": "#/$defs/quality" },
        "method": { "type": "string" },
        "body_site": { "type": "string" },
        "value": { "type": "number" },
        "unit": { "$ref": "#/$defs/unit" },
        "components": { "type": "array", "minItems": 1, "items": { "$ref": "#/$defs/component" } },
        "data_absent_reason": { "type": "string" }
      },
      "oneOf": [
        { "required": ["value", "unit"] },
        { "required": ["components"] },
        { "required": ["data_absent_reason"] }
      ]
    },
    "vitalsPayload": {
      "type": "object", "additionalProperties": false,
      "required": ["measurements"],
      "properties": {
        "measurements": { "type": "array", "minItems": 1, "items": { "$ref": "#/$defs/measurement" } }
      }
    },
    "labPayload": {
      "type": "object", "additionalProperties": false,
      "required": ["specimen", "report", "measurements"],
      "properties": {
        "specimen": {
          "type": "object", "additionalProperties": false,
          "required": ["specimen_id", "specimen_type", "collected_at"],
          "properties": {
            "specimen_id": { "type": "string" },
            "specimen_type": { "type": "string" },
            "collected_at": { "type": "string", "format": "date-time" }
          }
        },
        "report": {
          "type": "object", "additionalProperties": false,
          "required": ["report_id", "status"],
          "properties": {
            "report_id": { "type": "string" },
            "status": { "enum": ["registered", "partial", "preliminary", "final",
                                 "amended", "corrected", "cancelled", "entered-in-error", "unknown"] },
            "issued_at": { "type": ["string", "null"], "format": "date-time" },
            "verified_at": { "type": ["string", "null"], "format": "date-time" }
          }
        },
        "measurements": { "type": "array", "minItems": 1, "items": { "$ref": "#/$defs/measurement" } }
      }
    },
    "statusPayload": {
      "type": "object", "additionalProperties": false,
      "required": ["connectivity", "sensor_health"],
      "properties": {
        "connectivity": { "enum": ["online", "offline", "degraded"] },
        "sensor_health": { "enum": ["ok", "degraded", "fault", "unknown"] },
        "battery_percent": { "type": "number", "minimum": 0, "maximum": 100 },
        "last_measurement_at": { "type": "string", "format": "date-time" },
        "hardware_fault_codes": { "type": "array", "items": { "type": "string" } }
      }
    }
  }
}
