{
  "schema_version": "2.1",
  "message_id": "7a1c2d3e-0002-4a10-9b20-000000000201",
  "message_type": "observation.vitals",
  "event_time": "2026-10-21T21:56:23.695+07:00",
  "sequence_no": 201,
  "facility": {
    "facility_id": "PVL-ROBOT-DEV"
  },
  "gateway": {
    "gateway_id": "GW-ROBOT-DEV-001",
    "software_version": "0.2.0",
    "received_at": "2026-10-21T21:56:23.695+07:00",
    "published_at": "2026-10-21T21:56:23.695+07:00",
    "clock_source": "ntp"
  },
  "source": {
    "source_id": "ROBOT-DEV-001",
    "source_type": "robot_doctor",
    "connection": "wifi"
  },
  "patient_context": {
    "patient_id": "BN-TEST-000001",
    "patient_id_issuer": "PVL-ROBOT-DEV",
    "encounter_id": "ENC-TEST-000001",
    "encounter_id_issuer": "PVL-ROBOT-DEV",
    "binding": {
      "binding_id": "BIND-TEST-001",
      "method": "manual",
      "status": "pending_verification",
      "bound_at": "2026-10-21T21:56:23.695+07:00"
    }
  },
  "payload": {
    "measurements": [
      {
        "observation_id": "BP-001-000201-NIBP",
        "local_code": "nibp",
        "code": {
          "system": "http://loinc.org",
          "code": "85354-9",
          "display": "Blood pressure panel"
        },
        "measured_at": "2026-10-21T21:56:23.695+07:00",
        "status": "unknown",
        "quality": {
          "status": "unavailable",
          "reason": "measurement not completed"
        },
        "data_absent_reason": "not-available",
        "method": "non-invasive"
      },
      {
        "observation_id": "BP-001-000201-PR",
        "local_code": "pulse_rate",
        "code": {
          "system": "http://loinc.org",
          "code": "8867-4",
          "display": "Heart rate"
        },
        "measured_at": "2026-10-21T21:56:23.695+07:00",
        "status": "final",
        "value": 72,
        "unit": {
          "system": "http://unitsofmeasure.org",
          "code": "/min",
          "display": "beats/minute"
        },
        "quality": {
          "status": "good"
        }
      }
    ]
  }
}