{
  "schema_version": "2.1",
  "message_id": "3c551120-7a4d-43f8-8b23-db77953182ce",
  "message_type": "observation.lab",
  "event_time": "2026-10-21T21:56:23.700+07:00",
  "sequence_no": 106,
  "facility": {
    "facility_id": "PVL-ROBOT-DEV"
  },
  "gateway": {
    "gateway_id": "GW-ROBOT-DEV-001",
    "software_version": "0.2.0",
    "received_at": "2026-10-21T21:56:23.700+07:00",
    "published_at": "2026-10-21T21:56:23.700+07:00",
    "clock_source": "ntp"
  },
  "source": {
    "source_id": "ROBOT-DEV-001",
    "source_type": "lab_analyzer",
    "connection": "wifi"
  },
  "patient_context": {
    "patient_id": "BN-TEST-000001",
    "patient_id_issuer": "PVL-ROBOT-DEV",
    "encounter_id": "ENC-TEST-000001",
    "encounter_id_issuer": "PVL-ROBOT-DEV",
    "binding": {
      "binding_id": "BIND-TEST-001",
      "method": "manual",
      "status": "pending_verification",
      "bound_at": "2026-10-21T21:56:23.700+07:00"
    }
  },
  "payload": {
    "specimen": {
      "specimen_id": "GLU-001-SPEC-000106",
      "specimen_type": "capillary_blood",
      "collected_at": "2026-10-21T21:56:23.700+07:00"
    },
    "report": {
      "report_id": "GLU-001-RPT-000106",
      "status": "preliminary",
      "issued_at": null,
      "verified_at": null
    },
    "measurements": [
      {
        "observation_id": "GLU-001-000106-GLU",
        "local_code": "blood_glucose",
        "code": {
          "system": "http://loinc.org",
          "code": "14743-9",
          "display": "Glucose [Moles/volume] in Capillary blood by Glucometer"
        },
        "measured_at": "2026-10-21T21:56:23.700+07:00",
        "status": "preliminary",
        "value": 5.6,
        "unit": {
          "system": "http://unitsofmeasure.org",
          "code": "mmol/L",
          "display": "millimole per liter"
        },
        "quality": {
          "status": "good"
        }
      }
    ]
  }
}